{
  "$schema": "https://json-schema.org/draft/2020-12/schema",
  "type": "object",
  "additionalProperties": false,
  "required": [
    "analysis_plan_sha256",
    "claim_resolution_categories",
    "coverage",
    "definitive_execution_started",
    "fixture_sha256",
    "fourier_case_inventory",
    "manual_editing_required",
    "production_eligible",
    "rejections_are_excluded_from_estimands",
    "report_surfaces",
    "schema_version",
    "scientific_claim",
    "scientific_data",
    "terminal_case_inventory"
  ],
  "properties": {
    "analysis_plan_sha256": {},
    "claim_resolution_categories": {},
    "coverage": {},
    "definitive_execution_started": {},
    "fixture_sha256": {},
    "fourier_case_inventory": {},
    "manual_editing_required": {},
    "production_eligible": {},
    "rejections_are_excluded_from_estimands": {},
    "report_surfaces": {},
    "schema_version": {},
    "scientific_claim": {},
    "scientific_data": {},
    "terminal_case_inventory": {}
  }
}
