{
  "analysis_plan_sha256": "abc55668d10b9dc686345b24dd088b96f65576140c196ba9ae8cdab09d097630",
  "claim_resolution_categories": [
    {
      "category": "teacher phase effect persists in both student conditions",
      "reason": "synthetic topology exercise only",
      "scientific_conclusion": null,
      "synthetic_status": "met"
    },
    {
      "category": "students of one teacher vary materially",
      "reason": "synthetic topology exercise only",
      "scientific_conclusion": null,
      "synthetic_status": "not_met"
    },
    {
      "category": "all distilled students become similarly compressible",
      "reason": "synthetic topology exercise only",
      "scientific_conclusion": null,
      "synthetic_status": "indeterminate"
    },
    {
      "category": "results depend strongly on discovery method or fidelity definition",
      "reason": "synthetic topology exercise only",
      "scientific_conclusion": null,
      "synthetic_status": "unavailable"
    },
    {
      "category": "stable functions enable recovery while realization controls packing",
      "reason": "synthetic topology exercise only",
      "scientific_conclusion": null,
      "synthetic_status": "not_met"
    },
    {
      "category": "the predecessor transition disappears under predictive fidelity",
      "reason": "synthetic topology exercise only",
      "scientific_conclusion": null,
      "synthetic_status": "indeterminate"
    }
  ],
  "coverage": {
    "architectures": [
      "predecessor-matched/v1",
      "depth-2-matched-width/v1",
      "heads-8-matched-width/v1",
      "mlp-256-matched-residual/v1",
      "mlp-1024-matched-residual/v1"
    ],
    "bases": [
      "canonical heads-plus-neurons",
      "attention-coordinate refinement",
      "balanced 32-neuron blocks partition-0",
      "MLP rotation-0",
      "MLP rotation-1"
    ],
    "campaign_completion": [
      "tier1-intact-partial-tier2",
      "partial-tier3",
      "tier1-incomplete"
    ],
    "conditions": [
      "hard",
      "soft"
    ],
    "disagreements": [
      "architecture",
      "basis",
      "method"
    ],
    "endpoints": [
      "Endpoint 1",
      "procedure-relative packing lower bound"
    ],
    "methods": [
      "greedy-deletion-centred-logit/v1",
      "hard-concrete-gates-centred-logit/v1"
    ],
    "optional_teacher_seeds": [
      0,
      1,
      2,
      3,
      4
    ],
    "phases": [
      "pre-grokking",
      "50%",
      "stable post-grokking"
    ],
    "task1_teacher_seeds": [
      0,
      1,
      2,
      3,
      4,
      5,
      6,
      7,
      8,
      9,
      10,
      11,
      12,
      13,
      14
    ],
    "tasks": [
      1,
      2,
      3,
      4,
      5,
      "mod7-calibration"
    ],
    "tiers": [
      "tier1",
      "tier2-protected",
      "tier3-task3",
      "tier3-task4",
      "tier3-task5"
    ]
  },
  "definitive_execution_started": false,
  "fixture_sha256": "50ba2cbe09ffa0d28d98b1aea5a27c298ed38664b4284c013049c29af0a2a6ec",
  "fourier_case_inventory": [
    {
      "case_id": "fourier-winning",
      "controls": [
        "aligned_fourier_interchange",
        "wrong_fourier_mode",
        "shuffled_coefficients",
        "mismatched_input",
        "equal_norm_random_state",
        "unaligned_ordinary_activation_patching"
      ],
      "outcome": "winning"
    },
    {
      "case_id": "fourier-tying",
      "controls": [
        "aligned_fourier_interchange",
        "wrong_fourier_mode",
        "shuffled_coefficients",
        "mismatched_input",
        "equal_norm_random_state",
        "unaligned_ordinary_activation_patching"
      ],
      "outcome": "tying"
    },
    {
      "case_id": "fourier-losing",
      "controls": [
        "aligned_fourier_interchange",
        "wrong_fourier_mode",
        "shuffled_coefficients",
        "mismatched_input",
        "equal_norm_random_state",
        "unaligned_ordinary_activation_patching"
      ],
      "outcome": "losing"
    },
    {
      "case_id": "fourier-failing",
      "controls": [
        "aligned_fourier_interchange",
        "wrong_fourier_mode",
        "shuffled_coefficients",
        "mismatched_input",
        "equal_norm_random_state",
        "unaligned_ordinary_activation_patching"
      ],
      "outcome": "failing"
    },
    {
      "case_id": "fourier-incomplete",
      "controls": [
        "aligned_fourier_interchange",
        "wrong_fourier_mode",
        "shuffled_coefficients",
        "mismatched_input",
        "equal_norm_random_state",
        "unaligned_ordinary_activation_patching"
      ],
      "outcome": "incomplete"
    }
  ],
  "manual_editing_required": false,
  "production_eligible": false,
  "rejections_are_excluded_from_estimands": true,
  "report_surfaces": [
    {
      "denominators": [
        "planned",
        "available"
      ],
      "dimensions": [
        "task",
        "seed",
        "phase",
        "availability"
      ],
      "kind": "table",
      "missingness": "explicit unavailable/indeterminate; never imputed",
      "order": 1,
      "surface_id": "population-inventory",
      "synthetic_case_ids": [
        "eligible-hard",
        "eligible-soft",
        "attempt-failed",
        "student-insufficient",
        "teacher-unavailable",
        "phase-unavailable",
        "budget-censored",
        "search-failed",
        "packing-valid-zero",
        "packing-lower-bound",
        "packing-censored",
        "null-complete",
        "tractable-complete",
        "nonfinite",
        "corrupt",
        "duplicate",
        "stale",
        "conflict"
      ]
    },
    {
      "denominators": [
        "teacher_seed"
      ],
      "dimensions": [
        "seed",
        "phase",
        "condition",
        "method",
        "endpoint"
      ],
      "kind": "table",
      "missingness": "explicit unavailable/indeterminate; never imputed",
      "order": 2,
      "surface_id": "raw-teacher-seed",
      "synthetic_case_ids": [
        "eligible-hard",
        "eligible-soft",
        "attempt-failed",
        "student-insufficient",
        "teacher-unavailable",
        "phase-unavailable",
        "budget-censored",
        "search-failed",
        "packing-valid-zero",
        "packing-lower-bound",
        "packing-censored",
        "null-complete",
        "tractable-complete",
        "nonfinite",
        "corrupt",
        "duplicate",
        "stale",
        "conflict"
      ]
    },
    {
      "denominators": [
        "all_fixed_attempts"
      ],
      "dimensions": [
        "condition",
        "slot",
        "terminal_state"
      ],
      "kind": "table",
      "missingness": "explicit unavailable/indeterminate; never imputed",
      "order": 3,
      "surface_id": "student-attempt-inventory",
      "synthetic_case_ids": [
        "eligible-hard",
        "eligible-soft",
        "attempt-failed",
        "student-insufficient",
        "teacher-unavailable",
        "phase-unavailable",
        "budget-censored",
        "search-failed",
        "packing-valid-zero",
        "packing-lower-bound",
        "packing-censored",
        "null-complete",
        "tractable-complete",
        "nonfinite",
        "corrupt",
        "duplicate",
        "stale",
        "conflict"
      ]
    },
    {
      "denominators": [
        "eligible_initializations"
      ],
      "dimensions": [
        "seed",
        "phase",
        "condition",
        "architecture"
      ],
      "kind": "table",
      "missingness": "explicit unavailable/indeterminate; never imputed",
      "order": 4,
      "surface_id": "student-cell-summary",
      "synthetic_case_ids": [
        "eligible-hard",
        "eligible-soft",
        "attempt-failed",
        "student-insufficient",
        "teacher-unavailable",
        "phase-unavailable",
        "budget-censored",
        "search-failed",
        "packing-valid-zero",
        "packing-lower-bound",
        "packing-censored",
        "null-complete",
        "tractable-complete",
        "nonfinite",
        "corrupt",
        "duplicate",
        "stale",
        "conflict"
      ]
    },
    {
      "denominators": [
        "matched_teacher_seeds"
      ],
      "dimensions": [
        "seed",
        "phase",
        "condition",
        "method"
      ],
      "kind": "table",
      "missingness": "explicit unavailable/indeterminate; never imputed",
      "order": 5,
      "surface_id": "endpoint1-primary",
      "synthetic_case_ids": [
        "eligible-hard",
        "eligible-soft",
        "attempt-failed",
        "student-insufficient",
        "teacher-unavailable",
        "phase-unavailable",
        "budget-censored",
        "search-failed",
        "packing-valid-zero",
        "packing-lower-bound",
        "packing-censored",
        "null-complete",
        "tractable-complete",
        "nonfinite",
        "corrupt",
        "duplicate",
        "stale",
        "conflict"
      ]
    },
    {
      "denominators": [
        "sealed_ledger_masks"
      ],
      "dimensions": [
        "cap",
        "overlap",
        "method",
        "censoring"
      ],
      "kind": "table",
      "missingness": "explicit unavailable/indeterminate; never imputed",
      "order": 6,
      "surface_id": "packing-key-secondary",
      "synthetic_case_ids": [
        "eligible-hard",
        "eligible-soft",
        "attempt-failed",
        "student-insufficient",
        "teacher-unavailable",
        "phase-unavailable",
        "budget-censored",
        "search-failed",
        "packing-valid-zero",
        "packing-lower-bound",
        "packing-censored",
        "null-complete",
        "tractable-complete",
        "nonfinite",
        "corrupt",
        "duplicate",
        "stale",
        "conflict"
      ]
    },
    {
      "denominators": [
        "sealed_ledger_masks"
      ],
      "dimensions": [
        "threshold",
        "phase",
        "condition",
        "method"